{
  "id": "92b7b0dac4",
  "state": "open",
  "order_timestamp": "2025-06-01T18:02:05Z",
  "location_uid": "92b7b0dac4",
  "rewards": [
    "example"
  ],
  "points_products": [
    "example"
  ],
  "payments": [
    {
      "issuer": "example",
      "last4": "1234",
      "amount": 9.99,
      "authorized_at": "2025-06-01T18:02:05Z"
    }
  ],
  "items": [
    {
      "id": "92b7b0dac4",
      "name": "Pizza Town Co",
      "price": 9.99,
      "categories": [
        "example"
      ],
      "modifiers": [
        {
          "id": "92b7b0dac4",
          "name": "Pizza Town Co",
          "price": 9.99,
          "item_base_price": 9.99
        }
      ]
    }
  ],
  "subtotal": 9.99
}